{
  "$schema": "https://json-schema.org/draft/2020-12/schema",
  "$id": "https://reviewgraphen.dev/schemas/reviewgraphen.generic_review_run.v2.schema.json",
  "title": "ReviewGraphen generic non-authority review run v2",
  "type": "object", "additionalProperties": false,
  "required": ["schema", "run_id", "request_id", "legacy_ingestion", "ingestion_report_v2", "obligation_contract", "plan", "contexts", "observations", "provider_free_packet_bindings", "coverage", "verifier", "authority"],
  "properties": {
    "schema": {"const": "reviewgraphen.generic_review_run.v2"}, "run_id": {"$ref": "#/$defs/id"}, "request_id": {"$ref": "#/$defs/id"},
    "legacy_ingestion": {"$ref": "#/$defs/legacy_ingestion"}, "ingestion_report_v2": {"$ref": "#/$defs/ingestion_report"},
    "obligation_contract": {"type": "array", "maxItems": 2048, "items": {"$ref": "#/$defs/obligation"}},
    "plan": {"$ref": "#/$defs/plan"}, "contexts": {"type": "array", "maxItems": 2048, "items": {"$ref": "#/$defs/context"}}, "provider_free_packet_bindings": {"type": "array", "maxItems": 2048, "items": {"$ref": "#/$defs/provider_free_binding"}},
    "observations": {"type": "array", "maxItems": 2048, "items": {"$ref": "#/$defs/observation"}}, "coverage": {"$ref": "#/$defs/coverage"},
    "verifier": {"oneOf": [{"type": "null"}, {"$ref": "#/$defs/verifier"}]}, "authority": {"$ref": "#/$defs/authority"}
  },
  "$defs": {
    "hash": {"type": "string", "pattern": "^sha256:[0-9a-f]{64}$"}, "git_hash": {"type": "string", "pattern": "^git:[0-9a-f]{40}$"}, "id": {"type": "string", "pattern": "^[a-z][a-z0-9-]*:(?:sha256:[0-9a-f]{64}|[A-Za-z0-9._@:-]+)$"},
    "id_set": {"type": "array", "uniqueItems": true, "maxItems": 2048, "items": {"$ref": "#/$defs/id"}},
    "summary_id_set": {"type": "array", "uniqueItems": true, "maxItems": 20000, "items": {"$ref": "#/$defs/id"}},
    "obstruction_id_set": {"type": "array", "uniqueItems": true, "maxItems": 20001, "items": {"$ref": "#/$defs/id"}},
    "legacy_ingestion": {"type": "object", "additionalProperties": false, "required": ["repository_identity", "program_space_id", "snapshot_id", "base_commit_oid", "base_tree_hash", "target_commit_oid", "target_tree_hash"], "properties": {"repository_identity": {"type": "string", "minLength": 1}, "program_space_id": {"$ref": "#/$defs/id"}, "snapshot_id": {"$ref": "#/$defs/id"}, "base_commit_oid": {"type": "string", "pattern": "^[0-9a-f]{40}$"}, "base_tree_hash": {"$ref": "#/$defs/git_hash"}, "target_commit_oid": {"type": "string", "pattern": "^[0-9a-f]{40}$"}, "target_tree_hash": {"$ref": "#/$defs/git_hash"}}},
    "summary_bucket": {"type": "object", "additionalProperties": false, "required": ["call_kind", "reason", "observed_occurrence_count", "occurrence_id_set_sha256"], "properties": {"call_kind": {"enum": ["direct", "method", "macro_invocation"]}, "reason": {"enum": ["direct_non_path", "direct_empty_path", "direct_shadowed_binding", "direct_unresolved_scope", "direct_target_count_zero", "direct_target_count_multiple", "method_dispatch_unresolved", "macro_expansion_unresolved"]}, "observed_occurrence_count": {"type": "integer", "minimum": 1}, "occurrence_id_set_sha256": {"$ref": "#/$defs/hash"}}, "allOf": [{"if": {"properties": {"call_kind": {"const": "method"}}}, "then": {"properties": {"reason": {"const": "method_dispatch_unresolved"}}}}, {"if": {"properties": {"call_kind": {"const": "macro_invocation"}}}, "then": {"properties": {"reason": {"const": "macro_expansion_unresolved"}}}}, {"if": {"properties": {"call_kind": {"const": "direct"}}}, "then": {"properties": {"reason": {"enum": ["direct_non_path", "direct_empty_path", "direct_shadowed_binding", "direct_unresolved_scope", "direct_target_count_zero", "direct_target_count_multiple"]}}}}]},
    "occurrence_summary": {"type": "object", "additionalProperties": false, "required": ["schema", "id", "kind", "severity", "snapshot_id", "projection_extractor_id", "file_source_id", "path", "related_capabilities", "observed_occurrence_count", "occurrence_id_set_sha256", "buckets", "detail_retention"], "properties": {"schema": {"const": "reviewgraphen.ingestion_obstruction_summary.v1"}, "id": {"$ref": "#/$defs/id"}, "kind": {"const": "call_enumeration_summary"}, "severity": {"const": "medium"}, "snapshot_id": {"$ref": "#/$defs/id"}, "projection_extractor_id": {"const": "reviewgraphen.ingest.rust-call-enumeration@2"}, "file_source_id": {"$ref": "#/$defs/id"}, "path": {"type": "string", "minLength": 1}, "related_capabilities": {"const": ["direct_calls"]}, "observed_occurrence_count": {"type": "integer", "minimum": 1}, "occurrence_id_set_sha256": {"$ref": "#/$defs/hash"}, "buckets": {"type": "array", "minItems": 1, "maxItems": 8, "uniqueItems": true, "items": {"$ref": "#/$defs/summary_bucket"}}, "detail_retention": {"const": "spans_and_owner_sources_omitted_rebuildable"}}},
    "limitation": {"type": "object", "additionalProperties": false, "required": ["schema", "id", "snapshot_id", "projection_extractor_id", "kind", "severity", "description", "source_ids", "related_capabilities", "latent_occurrence_count"], "properties": {"schema": {"const": "reviewgraphen.ingestion_global_limitation.v2"}, "id": {"$ref": "#/$defs/id"}, "snapshot_id": {"$ref": "#/$defs/id"}, "projection_extractor_id": {"const": "reviewgraphen.ingest.rust-call-enumeration@2"}, "kind": {"const": "global_direct_calls_limitation"}, "severity": {"const": "info"}, "description": {"const": "direct_calls enumeration is incomplete; macro latent occurrence count is unknown"}, "source_ids": {"$ref": "#/$defs/id_set"}, "related_capabilities": {"const": ["direct_calls"]}, "latent_occurrence_count": {"const": "unknown"}}},
    "ingestion_report": {"type": "object", "additionalProperties": false, "required": ["schema", "report_id", "snapshot_id", "projection_extractor_id", "source_occurrence_summaries", "observed_occurrence_count", "occurrence_id_set_sha256", "global_direct_calls_limitation"], "properties": {"schema": {"const": "reviewgraphen.generic_ingestion_projection.v2"}, "report_id": {"$ref": "#/$defs/id"}, "snapshot_id": {"$ref": "#/$defs/id"}, "projection_extractor_id": {"const": "reviewgraphen.ingest.rust-call-enumeration@2"}, "source_occurrence_summaries": {"type": "array", "uniqueItems": true, "maxItems": 20000, "items": {"$ref": "#/$defs/occurrence_summary"}}, "observed_occurrence_count": {"type": "integer", "minimum": 0}, "occurrence_id_set_sha256": {"$ref": "#/$defs/hash"}, "global_direct_calls_limitation": {"$ref": "#/$defs/limitation"}}},
    "obligation": {"type": "object", "additionalProperties": false, "required": ["id", "rule_id", "property_id", "target_kind", "target_refs", "target_support_capabilities", "enumeration_capabilities", "applicability_status"], "properties": {"id": {"$ref": "#/$defs/id"}, "rule_id": {"type": "string", "minLength": 1}, "property_id": {"type": "string", "minLength": 1}, "target_kind": {"type": "string", "minLength": 1}, "target_refs": {"$ref": "#/$defs/id_set"}, "target_support_capabilities": {"type": "array", "uniqueItems": true, "items": {"type": "string", "minLength": 1}}, "enumeration_capabilities": {"type": "array", "uniqueItems": true, "items": {"type": "string", "minLength": 1}}, "applicability_status": {"enum": ["applicable", "unknown", "not_applicable"]}}},
    "wave": {"type": "object", "additionalProperties": false, "required": ["id", "obligation_ids"], "properties": {"id": {"$ref": "#/$defs/id"}, "obligation_ids": {"$ref": "#/$defs/id_set"}}},
    "plan": {"type": "object", "additionalProperties": false, "required": ["id", "universe_id", "waves", "deferred_obligation_ids"], "properties": {"id": {"$ref": "#/$defs/id"}, "universe_id": {"$ref": "#/$defs/id"}, "waves": {"type": "array", "maxItems": 1024, "items": {"$ref": "#/$defs/wave"}}, "deferred_obligation_ids": {"$ref": "#/$defs/id_set"}}},
    "context": {"type": "object", "additionalProperties": false, "required": ["obligation_id", "wave_id", "context_id", "projection_hash", "context_policy", "context_policy_hash", "caller_artifact_id", "callee_artifact_id", "candidate_source_ids", "window_ids", "subject_loss_ids"], "properties": {"obligation_id": {"$ref": "#/$defs/id"}, "wave_id": {"$ref": "#/$defs/id"}, "context_id": {"$ref": "#/$defs/id"}, "projection_hash": {"$ref": "#/$defs/hash"}, "context_policy": {"const": "context.subject_windows@2"}, "context_policy_hash": {"$ref": "#/$defs/hash"}, "caller_artifact_id": {"$ref": "#/$defs/id"}, "callee_artifact_id": {"$ref": "#/$defs/id"}, "candidate_source_ids": {"$ref": "#/$defs/id_set"}, "window_ids": {"$ref": "#/$defs/id_set"}, "subject_loss_ids": {"$ref": "#/$defs/id_set"}}},
    "proposal": {"type": "object", "additionalProperties": false, "required": ["property_id", "target_refs", "polarity", "summary", "source_ids", "assumptions", "requested_evidence", "candidate_confidence", "disposition", "author_kind", "review_status"], "properties": {"property_id": {"type": "string", "minLength": 1}, "target_refs": {"$ref": "#/$defs/id_set"}, "polarity": {"enum": ["issue_present", "issue_absent", "inconclusive", "not_applicable", "conflict"]}, "summary": {"type": "string", "minLength": 1}, "source_ids": {"$ref": "#/$defs/id_set"}, "assumptions": {"type": "array", "uniqueItems": true, "items": {"type": "string"}}, "requested_evidence": {"type": "array", "uniqueItems": true, "items": {"type": "string"}}, "candidate_confidence": {"oneOf": [{"type": "null"}, {"type": "number", "minimum": 0, "maximum": 1}]}, "disposition": {"const": "proposed"}, "author_kind": {"const": "ai"}, "review_status": {"const": "unreviewed"}}},
    "observation": {"oneOf": [
      {"type": "object", "additionalProperties": false, "required": ["kind", "id", "schema", "observer_id", "obligation_id", "execution_id", "input_manifest_hash", "raw_response", "raw_response_hash", "reason", "detail"], "properties": {"kind": {"const": "deterministic_abstain"}, "id": {"$ref": "#/$defs/id"}, "schema": {"const": "reviewgraphen.generic_observation.v2"}, "observer_id": {"const": "deterministic.abstain@1"}, "obligation_id": {"$ref": "#/$defs/id"}, "execution_id": {"$ref": "#/$defs/id"}, "input_manifest_hash": {"$ref": "#/$defs/hash"}, "raw_response": {"type": "string", "minLength": 1}, "raw_response_hash": {"$ref": "#/$defs/hash"}, "reason": {"const": "required_evidence_unavailable"}, "detail": {"const": "deterministic.abstain@1 does not evaluate semantic properties"}}},
      {"type": "object", "additionalProperties": false, "required": ["kind", "schema", "observer_id", "obligation_id", "execution_id", "input_manifest_hash", "raw_response", "raw_response_hash", "proposals"], "properties": {"kind": {"const": "proposed_claim"}, "schema": {"const": "reviewgraphen.generic_observation.v2"}, "observer_id": {"type": "string", "minLength": 1}, "obligation_id": {"$ref": "#/$defs/id"}, "execution_id": {"$ref": "#/$defs/id"}, "input_manifest_hash": {"$ref": "#/$defs/hash"}, "raw_response": {"type": "string", "minLength": 1}, "raw_response_hash": {"$ref": "#/$defs/hash"}, "proposals": {"type": "array", "minItems": 1, "maxItems": 16, "items": {"$ref": "#/$defs/proposal"}}}},
      {"type": "object", "additionalProperties": false, "required": ["kind", "schema", "observer_id", "obligation_id", "execution_id", "input_manifest_hash", "raw_response", "raw_response_hash", "reason", "diagnostic"], "properties": {"kind": {"const": "malformed"}, "schema": {"const": "reviewgraphen.generic_observation.v2"}, "observer_id": {"type": "string", "minLength": 1}, "obligation_id": {"$ref": "#/$defs/id"}, "execution_id": {"$ref": "#/$defs/id"}, "input_manifest_hash": {"$ref": "#/$defs/hash"}, "raw_response": {"type": "string", "minLength": 1}, "raw_response_hash": {"$ref": "#/$defs/hash"}, "reason": {"type": "string", "minLength": 1}, "diagnostic": {"type": "string", "minLength": 1}}},
      {"type": "object", "additionalProperties": false, "required": ["kind", "schema", "observer_id", "obligation_id", "execution_id", "input_manifest_hash", "raw_response", "raw_response_hash", "retryable", "diagnostic"], "properties": {"kind": {"const": "provider_failure"}, "schema": {"const": "reviewgraphen.generic_observation.v2"}, "observer_id": {"type": "string", "minLength": 1}, "obligation_id": {"$ref": "#/$defs/id"}, "execution_id": {"$ref": "#/$defs/id"}, "input_manifest_hash": {"$ref": "#/$defs/hash"}, "raw_response": {"type": "string", "minLength": 1}, "raw_response_hash": {"$ref": "#/$defs/hash"}, "retryable": {"type": "boolean"}, "diagnostic": {"type": "string", "minLength": 1}}}
    ]},
    "provider_free_binding": {"type": "object", "additionalProperties": false, "required": ["schema", "id", "task_id", "execution_id", "reviewer_packet_sha256", "source_inventory_id", "source_inventory_sha256", "input_manifest_hash", "observer_id", "observation_record_id"], "properties": {"schema": {"const": "reviewgraphen.provider_free_packet_binding.v1"}, "id": {"$ref": "#/$defs/id"}, "task_id": {"type": "string", "pattern": "^provider-free-review-task:sha256:[0-9a-f]{64}$"}, "execution_id": {"$ref": "#/$defs/id"}, "reviewer_packet_sha256": {"$ref": "#/$defs/hash"}, "source_inventory_id": {"$ref": "#/$defs/id"}, "source_inventory_sha256": {"$ref": "#/$defs/hash"}, "input_manifest_hash": {"$ref": "#/$defs/hash"}, "observer_id": {"const": "deterministic.abstain@1"}, "observation_record_id": {"$ref": "#/$defs/id"}}},
    "coverage": {"type": "object", "additionalProperties": false, "required": ["rule_id", "resolved_target_obligation_ids", "candidate_space_gap_obligation_ids", "enumeration_capability_states", "enumeration_limitation_ids", "enumeration_obstruction_summary_ids", "enumeration_obstruction_ids", "observed_unresolved_call_occurrence_count", "occurrence_id_set_sha256", "planned_obligation_ids", "deferred_obligation_ids", "executed_obligation_ids", "structured_obligation_ids", "abstained_obligation_ids", "malformed_obligation_ids", "provider_failed_obligation_ids", "verifier_observed_obligation_ids", "call_graph_complete", "global_call_coverage_claim"], "properties": {"rule_id": {"const": "relation.changed_public_callee@1"}, "resolved_target_obligation_ids": {"$ref": "#/$defs/id_set"}, "candidate_space_gap_obligation_ids": {"$ref": "#/$defs/id_set"}, "enumeration_capability_states": {"type": "object", "additionalProperties": false, "required": ["direct_calls"], "properties": {"direct_calls": {"const": "partial"}}}, "enumeration_limitation_ids": {"$ref": "#/$defs/id_set"}, "enumeration_obstruction_summary_ids": {"$ref": "#/$defs/summary_id_set"}, "enumeration_obstruction_ids": {"$ref": "#/$defs/obstruction_id_set"}, "observed_unresolved_call_occurrence_count": {"type": "integer", "minimum": 0}, "occurrence_id_set_sha256": {"$ref": "#/$defs/hash"}, "planned_obligation_ids": {"$ref": "#/$defs/id_set"}, "deferred_obligation_ids": {"$ref": "#/$defs/id_set"}, "executed_obligation_ids": {"$ref": "#/$defs/id_set"}, "structured_obligation_ids": {"$ref": "#/$defs/id_set"}, "abstained_obligation_ids": {"$ref": "#/$defs/id_set"}, "malformed_obligation_ids": {"$ref": "#/$defs/id_set"}, "provider_failed_obligation_ids": {"$ref": "#/$defs/id_set"}, "verifier_observed_obligation_ids": {"$ref": "#/$defs/id_set"}, "call_graph_complete": {"const": false}, "global_call_coverage_claim": {"const": "prohibited"}}},
    "verifier": {"type": "object", "additionalProperties": false, "required": ["id", "descriptor_id", "request_id", "snapshot_id", "universe_id", "outcome", "reason", "process_started", "executable_resolved", "verifier_observed_obligation_ids"], "properties": {"id": {"$ref": "#/$defs/id"}, "descriptor_id": {"const": "workspace.cargo_test@1"}, "request_id": {"$ref": "#/$defs/id"}, "snapshot_id": {"$ref": "#/$defs/id"}, "universe_id": {"$ref": "#/$defs/id"}, "outcome": {"const": "unsupported"}, "reason": {"const": "workspace_cargo_test_deferred"}, "process_started": {"const": false}, "executable_resolved": {"const": false}, "verifier_observed_obligation_ids": {"const": []}}},
    "authority": {"type": "object", "additionalProperties": false, "required": ["classification", "trusted_pass", "result_status", "incomplete_reasons"], "properties": {"classification": {"const": "non_authority"}, "trusted_pass": {"const": false}, "result_status": {"const": "incomplete"}, "incomplete_reasons": {"type": "array", "uniqueItems": true, "minItems": 3, "items": {"enum": ["candidate_space_enumeration_incomplete", "human_decision_not_recorded", "model_observer_non_authority", "obligations_deferred", "reviewer_abstained", "reviewer_output_malformed", "reviewer_provider_failure", "verifier_unsupported"]}, "allOf": [{"contains": {"const": "candidate_space_enumeration_incomplete"}}, {"contains": {"const": "human_decision_not_recorded"}}, {"contains": {"const": "model_observer_non_authority"}}]}}}
  }
}
