{
  "schema":"reviewgraphen.generic_review_run.v2",
  "run_id":"run:sha256:0000000000000000000000000000000000000000000000000000000000000000",
  "request_id":"request:sha256:0000000000000000000000000000000000000000000000000000000000000001",
  "legacy_ingestion":{"repository_identity":"example/repository","program_space_id":"snapshot:sha256:0000000000000000000000000000000000000000000000000000000000000002","snapshot_id":"snapshot:sha256:0000000000000000000000000000000000000000000000000000000000000002","base_commit_oid":"0000000000000000000000000000000000000000","base_tree_hash":"git:0000000000000000000000000000000000000000","target_commit_oid":"1111111111111111111111111111111111111111","target_tree_hash":"git:1111111111111111111111111111111111111111"},
  "ingestion_report_v2":{"schema":"reviewgraphen.generic_ingestion_projection.v2","report_id":"generic-ingestion-report:sha256:44927a289b63e47eb2ef8942ba22ac049fe60e1db2320d24abdf0fa53f9de3c8","snapshot_id":"snapshot:sha256:0000000000000000000000000000000000000000000000000000000000000002","projection_extractor_id":"reviewgraphen.ingest.rust-call-enumeration@2","source_occurrence_summaries":[],"observed_occurrence_count":0,"occurrence_id_set_sha256":"sha256:4f53cda18c2baa0c0354bb5f9a3ecbe5ed12ab4d8e11ba873c2f11161202b945","global_direct_calls_limitation":{"schema":"reviewgraphen.ingestion_global_limitation.v2","id":"ingestion-limitation:sha256:0000000000000000000000000000000000000000000000000000000000000006","snapshot_id":"snapshot:sha256:0000000000000000000000000000000000000000000000000000000000000002","projection_extractor_id":"reviewgraphen.ingest.rust-call-enumeration@2","kind":"global_direct_calls_limitation","severity":"info","description":"direct_calls enumeration is incomplete; macro latent occurrence count is unknown","source_ids":["file:sha256:0000000000000000000000000000000000000000000000000000000000000007"],"related_capabilities":["direct_calls"],"latent_occurrence_count":"unknown"}},
  "obligation_contract":[],
  "plan":{"id":"plan:sha256:0000000000000000000000000000000000000000000000000000000000000009","universe_id":"universe:sha256:0000000000000000000000000000000000000000000000000000000000000010","waves":[],"deferred_obligation_ids":[]},
  "contexts":[],
  "observations":[],
  "provider_free_packet_bindings":[],
  "coverage":{"rule_id":"relation.changed_public_callee@1","resolved_target_obligation_ids":[],"candidate_space_gap_obligation_ids":["obligation:sha256:0000000000000000000000000000000000000000000000000000000000000008"],"enumeration_capability_states":{"direct_calls":"partial"},"enumeration_limitation_ids":["ingestion-limitation:sha256:0000000000000000000000000000000000000000000000000000000000000006"],"enumeration_obstruction_summary_ids":[],"enumeration_obstruction_ids":["ingestion-limitation:sha256:0000000000000000000000000000000000000000000000000000000000000006"],"observed_unresolved_call_occurrence_count":0,"occurrence_id_set_sha256":"sha256:4f53cda18c2baa0c0354bb5f9a3ecbe5ed12ab4d8e11ba873c2f11161202b945","planned_obligation_ids":[],"deferred_obligation_ids":[],"executed_obligation_ids":[],"structured_obligation_ids":[],"abstained_obligation_ids":[],"malformed_obligation_ids":[],"provider_failed_obligation_ids":[],"verifier_observed_obligation_ids":[],"call_graph_complete":false,"global_call_coverage_claim":"prohibited"},
  "verifier":null,
  "authority":{"classification":"non_authority","trusted_pass":false,"result_status":"incomplete","incomplete_reasons":["candidate_space_enumeration_incomplete","human_decision_not_recorded","model_observer_non_authority"]}
}
